what about your friends,tlc,1993," What about your friends?
What about?
What about your friends?
What about, what about? Every now and then I get a little crazy
That's not the way it's supposed to be
Sometimes my vision is a little hazy
I can't tell who I should trust or just who I let trust me, yeah People try to say I act a little funny
But that's just a figure of speech to me
They tell me I changed because I got money
But if you were there before then you're still down with me What about your friends?
Will they stand their ground? Will they let you down again?
What about your friends?
Are they gonna be low down? Will they ever be around
Or will they turn their backs on you Well is it me or can it be I'm a little too friendly
So to speak hypothetically say I supply creativity
To what others must take as a form of self-hate
Only to make an enemy which results in unfortunate destiny
They dog me out then be next to me
Just 'cause I am what some choose to envy Every now and then I get a little easy
I let a lot of people depend on me
I never thought they would ever deceive me
Don't you know when times got rough I was standing on my own? I'll never let another get that close to me
You see I've grown a lot smarter now
Sometimes you have to choose and then you'll see
If your friend is true they'll be there with you through the thick and thin What about your friends?
Will they stand their ground? Will they let you down again?
What about your friends?
Are they gonna be low down? Will they ever be around
Or will they turn their backs on you What about your friends
Will they stand their ground
Will they let you down again
What about your friends are they gonna be low down
Will they ever be around or will they turn their backs on you
Yo, this is me, well is it me or can it be I'm a little too friendly So to speak hypothetically say I supply creativity
To what others must take as a form of self-hate
Only to make an enemy which results in unfortunate destiny
They dog me out then be next to me
Just 'cause I am what some choose to envy What about your friends?
Will they stand their ground? Will they let you down again?
What about your friends?
Are they gonna be low down? Will they ever be around
Or will they turn their backs on you
What about your friends
Will they stand their ground
Will they let you down again
What about your friends are they gonna be low down
Will they ever be around or will they turn their backs on you
People say I act a little funny, I wouldn't change not for no money
I'll be a friend as long as you're a friend to me, yeah, yeah
Even though I might seem easy, it don't give you no cause to deceive me
It's not the way that I want my friends to ever be
What about your friends?
Will they stand their ground? Will they let you down again?
What about your friends?
Are they gonna be low down? Will they ever be around
Or will they turn their backs on you
What about your friends?
Will they stand their ground? Will they let you down again?"
i got a man,positive k,1993," Aiyyo sweetie, you're lookin kinda pretty
What's a girl like you, doin in this rough city
I'm just here, tryin to hold my own ground
Yeah, I think I like how that sound
What you say we gets to know each other better?
That sounds good but I don't think that I can let ya
I don't know, tell me is it so
Do you get a kick, out of tellin brothers no?
No it's not that see you don't understand
How should I put it, I got a man
What's your man got to do with me?
I told ya
I'm not tryin to hear that see
I'm not one of those girls that go rippin around
I'm not a dove baby, so don't play me like a clown
I'll admit, I like how you kick it
Now you're talkin baby, dats da ticket
Now don't get excited and chuck your own in
I already told ya, I got a man
What's your man got to do with me?
I got a man
I'm not tryin to hear that see
I got a man
What's your man got to do with me?
I got a man
I'm not tryin to hear that
Now you can persist and play Don Juan all night
But ain't nothin gonna change
Yeah baby, sure you're right
I'ma break it down and do whatever I gots to do
I'll tell you now, I got eyes for you
You got eyes, but they're not for me
You better use them for what they're for and that's to see
You know what's the problem, ya not used to learnin
I'm Big Daddy Longstroke, and your man's Pee Wee Herman
I got a question to ask you troop
Are you a chef, cause you keep feedin me soup
You know what they say about those who sweat thyself
You might find yourself, by yourself
I'm not waitin because I'm no waiter
So when I blow up, don't try to kick it to me later
All them girls must got you gassed
A-when they see a good thing they don't let it pass
Well that's OK, cause see if that's their plan
Cause for me, I already got a man
What's your man got to do with me?
I got a man
I'm not tryin to hear that see
I got a man
What's your man got to do with me?
I got a man
I'm not tryin to hear that
What am I, some crab inmate
that just came home from jail sweatin you for a date?
I don't want no beef, I just wants to get together
But how you talkin, pssssh, whatevah!
We can't have nothin
It all depends
Well if we can't be lovers than we can't be friends
Well then I guess it's nothing
Well hey I think you're bluffing
Well I'ma call my man
Well I can get raggamuffin
Ya better catch a flashback remember I'm not crabbin it
You know my style, from I'm Not Havin It
All I remember's an excuse me miss
You can't get a guy like me with a line like this
Well look I'll treat you good
My man treats me better
I talk sweet on the phone
My man writes love letters
I'll tell you that I want you, and tell you that I care
My man says the same except he's sincere
Well I'm clean cut and dapper, that's what I'm about
My man buys me things and he takes me out
Well you can keep your man, cause I don't go that route
Don't you know yu haffa respeck me
There's a lot of girls out there who won't say no
You're out for mami with your DJ Money
Boom batter my pockets is gettin fatter
I wanna turn you on and excite you
Let me know the spot on your body and I bite you
So when your man don't treat you like he used to
I kick in like a turbo booster
You want lovin you don't have to ask when
Your man's a headache, I'll be your aspirin
All confusion, you know I'll solve em
I got a man
You got a what?
How long you had that problem?
What's your man got to do with me?
I got a man
I'm not tryin to hear that see
I got a man
What's your man got to do with me?
I got a man
I'm not tryin to hear that
I got a man
Aiyyo baby put the dial numbers or your address
I got a man
I told ya I treat you right
I got a man
Aww c'mon now ain't no future in frontin
I'm not havin it
C'mon Miss, oh we back on that again
Uhh, I'm not tryin to hear that see
I got a man
But your man ain't me
Uhh, uhh, I got a man
You got a WHAT?
Uhh, uhh, uhh, I got a man
You got a WHAT?"
hey mr dj,zhane,1993," [1:]
Everybody move your body
Now do it
Here is something that's gonna make you move & groove
Hey D.J. keep playing that song, all night
On and on and on
Everybody move your body
Now do it
Here is something that's gonna make you move & grove
Hey D.J. keep playing that song, all night
On and on and on
[2:]
It's Friday night and the weekend's here
I need to unwind, where's the party, Mr. D.J
I am ready to call my friends
So we could all get down
Where's the party, hey Mr. D.J
[3:]
Hey Mr. D.J
(You can get this started)
Everybody's ready to party
(All night, all night)
All the girls are ready
(So we can all get to it)
So we can party 'till the break of dawn, oh
[Repeat 1]
[Repeat 2]
[Repeat 3]
[Rap]
Once again, it's on, yo Zhane blow the horn
Let the D.J. know to keep playing your song
Maybe I'll browse, snatch up the blouse
Rip the foul, ho
And get rub-a-dub style
Cuz your body won't move
If it can't feel the groove
So can't boogie, have to show and prove
Hey, now I'm feeling the vibe
Rolling wit the flava
Feeling alright
Ho, yo, there's a party over here
Yo, oh no, the party's over there
Call up your friends, let 'em know
Fam's tagging along
Hey D.J. keep playing that song
Everybody move your body
Now do it
[Repeat 1 until fade]"
insane in the brain,cypress hill,1993," To the one on the flamboyant temper, just toss that ham
In the fryin' pan Like spam
Feel done when I come in slam
Damn
I feel like the son of sam
Don't make me wreck shit hectic
Next to the chair got me goin' like General Electric
EEEN!
The lights are blinking
I'm thinking
It's all over when I go out drinking
Oh, makin' my mind slow
That's why I don't fuck wit da big four-o
Bro', I got ta maintain
'Cause a nigga like me is goin' insane
Insane in the membrane
Insane in the brain! Insane in the membrane
Insane in the brain!
Insane in the membrane
Crazy insane Got no brain!
Insane in the membrane
Insane in the brain!
Do my shit undercover
Now it's time for the blubba Blabba
To watch that belly get fatter
Fat boy on a diet
Don't try it
I'll jack your ass like a looter in a riot
My shit's fat like a sumo slammin' that ass
Leavin' your face in the grass
You know
I don't take a dulo
Lightly
Punks just jealous 'cause they can't outwrite me
Or kick that style: wicked, wild
Happy face nigga never seen me smile
Rip that mainframe
I'll explain
A nigga like me is goin' insane
Insane in the membrane
Insane in the brain! Insane in the membrane
Insane in the brain!
Insane in the membrane
crazy insane Got no brain!
Insane in the membrane
Insane in the brain!
Insane in the brain
In the brain It's because I'm loco
Insane in the brain
In the brain It's because I'm loco
Insane in the brain
In the brain Insane
It's because I'm loco
Insane in the brain
Like Louie Armstrong Played the trumpet I'll hit dat bong and break ya off something soon
I got to get my props
Cops
Come and try to snatch my crops
These pigs wanna blow my house down
Head underground
To the next town
They get mad
When they come to raid my pad
And I'm out in the nine deuce Cad'
Yes I'm the pirate pilot
Of this ship if I get
Wit' the ultraviolet dream
Hide from the red light beam
Now do you believe in the unseen
Look, but don't make your eyes strain
A nigga like me is goin' insane
Insane in the membrane
Insane in the brain! Insane in the membrane
Insane in the brain!
Insane in the membrane
crazy insane
Got no brain!
Insane in the membrane
Insane in the brain!
Insane in the brain
It's because I'm loco
Insane in the brain
It's because I'm loco
Insane in the brain
It's because I'm loco
Insane in the brain
It's because I'm loco
""...I think I'm going crazy..."""
deeper and deeper,madonna,1993," Deeper and deeper and deeper and deeper
Sweeter and sweeter and sweeter and sweeter I can't help falling in love
I fall deeper and deeper the further I go
Kisses sent from heaven above
They get sweeter and sweeter the more that I know When you know the notes to sing, you can sing 'most anything
That's what my mama told me
'Round and 'round and 'round you go
When you find love, you'll always know
I let my father mold me Daddy couldn't be all wrong
(Not gonna let you slip away, I'm gonna be there)
And my mama made me learn this song
(You're gonna bring your love to me, I'm gonna get you) That's why I can't help falling in love
I fall deeper and deeper the further I go
Kisses sent from heaven above
They get sweeter and sweeter the more that I know, the deeper I go ""All is fair in love"", she said,
Think with your heart, not with your head
That's what my mama told me
All the little things you do will end up coming back to you
I let my father mold me Daddy couldn't be all wrong
(Not gonna let you slip away, I'm gonna be there)
And my mama made me learn this song
(You're gonna bring your love to me, I'm gonna get you) That's why I can't help falling in love
I fall deeper and deeper the further I go
Kisses sent from heaven above
They get sweeter and sweeter the more that I know I can't help falling in love
I fall deeper and deeper the further I go
Kisses sent from heaven above
They get sweeter and sweeter the more that I know Someone said that romance was dead
And I believed it instead of remembering what my mama told me
Let my father mold me, then you tried to hold me
You remind me of what they said
This feeling inside, I can't explain
But my love is alive and I'm never gonna hide it again Daddy couldn't be all wrong
(Not gonna let you slip away, I'm gonna be there)
And my mama made me learn this song
(You're gonna bring your love to me, I'm gonna get you) That's why I can't help falling in love
I fall deeper and deeper the further I go
Kisses sent from heaven above
They get sweeter and sweeter the more that I know Deeper and deeper and deeper and deeper
Never gonna hide it again
Sweeter and sweeter and sweeter and sweeter
Never gonna have to pretend Deeper and deeper and deeper and deeper
Never gonna hide it again
Sweeter and sweeter and sweeter and sweeter
Never gonna have to pretend You got to just let your body move to the music
You got to just let your body go with the flow Falling in love, falling in love, falling in love
I can't keep from falling in love with you
You know there's nothing better that I'd like to do"
rain,madonna,1993," I feel it
It's coming Rain... feel it on my finger tips
Hear it on my window pane
Your love's coming down like rain...
Wash away my sorrow
Take away my pain
Your love's coming down like rain... When your lips are burning mine
And you take the time
To tell me how you feel
When you listen to my words
And I know you've heard
I know it's real
Rain is what this thunder brings
For the first time, I can hear my heart sing
Call me a fool but I know I'm not
I'm gonna stand out here on the mountain top
Till I feel your Rain... feel it on my finger tips
Hear it on my window pane
Your love's coming down like rain...
Wash away my sorrow, take away my pain
Your love's coming down like rain... When you looked into my eyes
And you said goodbye
Could you see my tears...
When I turned the other way
Did you hear me say
I'd wait for all the dark clouds bursting in a perfect sky
You promised me when you said goodbye
That you'd return when the storm was done
And now I wait for the light,
I'll wait for the sun, till I feel your Rain... feel it on my finger tips
Hear it on the window pane
Your love's coming down like rain...
Wash away my sorrow, take away my pain
Your love's coming down like Here comes the sun
Here comes the sun
And I say... never go away... Waiting is the hardest thing [It's strange]
I tell myself that if I believe in you [I feel like I've known you before]
In the dream of you [I want to understand you more]
With all my heart and all my soul [And more and more]
That by sheer force of will [When I'm with you]
I will raise you from the ground [I feel like a magical child]
And without a sound you'll appear [Everything strange]
And surrender to me [Everything wild]
To love Rain is what the thunder brings
For the first time, I can hear my heart sing
Call me a fool but I know I'm not
I'm gonna stand out here on the mountain top
Till I feel your Rain...
I feel it, it's coming
Your love's coming down like rain...
I feel it, it's coming
Your love's coming down like rain...
Feel it on my finger tips
Hear it on the window pane
Your love's coming down like rain...
Wash away my sorrow, take away my pain
Your love's coming down like rain... I feel it, it's coming
Your love's coming down like rain...
I feel it, it's coming
Your love's coming down like rain... You step out on the mountaintop
And you're free to call my name
Rain..."
the right kind of love,jeremy jordan,1993," It's the right kind of love
It's the right kind of night
You're the right kind of girl
Ooh
Oh, yeah
Hey, hey, ooh
It's the right kind of love
Kind of love Daydreamin' about you baby
And it must be love
Girl you make my heart go crazy
High as the Heaven's above, oh yeah I hope you're thinkin' about me girl
Because all of my thoughts are with you
My love
There's no reason to doubt me
Believe me it's true
Girl, I know that I can give you The right kind of love
It's the right kind of night
You're the right kind of girl
And we're right on time Oh now baby
You know we can't go wrong, no
Why you trying to hold back baby
Tell me what you feel, yeah?
If you're having mixed emotions
I'll show you that I'm for real What can I do to make you see?
There's nobody but you
And girl
It's not magic or fantasy
It's simple and true
I know that I can give you The right kind of love
It's the right kind of night
You're the right kind of girl
I'm the right kind of guy It's the right kind of love
On the right kind of night
There's the right kind of stars
In the right kind of sky Oh now baby
You know we can't go wrong
Girl, I got a heart that's true
I got the right kind of love
I'm gonna give it to you
And you got me romantic
Can't you see?
I'm the guy for you
And you're the girl for me I got a heart that's true
And a soul that's deep
I'll be the right kind of lover
Baby can't you see?
I'm gonna treat you
The right kind of way
You know it
So come on, girl stay Kind of love
Kind of night
You're the right kind of girl
And we're right on time
It's the right kind of love
On the right kind of night
There's the right kind of stars
Ooh I could do with a girl like you
I could do with a girl like you
I could do with a girl like you
See what I can do with a girl like you
Yeah
It's you and me together
It's the right kind of love
Right kind of stars"
bad boys,inner circle,1993," Bad boys, whatcha want
Watcha want, whatcha gonna do?
When sheriff John Brown come for you
Tell me whatcha wanna do, whatcha gonna do? Bad boys, bad boys whatcha gonna do?
Whatcha gonna do when they come for you?
Bad boys, bad boys whatcha gonna do?
Whatcha gonna do when they come for you? When you were eight and you had bad traits
You go to school and learn the golden rule
So why are you acting like a bloody fool?
If you get hot, you must get cool Bad boys, bad boys whatcha gonna do?
Whatcha gonna do when they come for you?
Bad boys, bad boys whatcha gonna do?
Whatcha gonna do when they come for you? You chuck it on that one
You chuck it on this one
You chuck it on your mother
And you chuck it on your father You chuck it on your brother
And you chuck it on your sister
You chuck it on that one
And you chuck it on me Bad boys, bad boys whatcha gonna do?
Whatcha gonna do when they come for you?
Bad boys, bad boys whatcha gonna do?
Whatcha gonna do when they come for you? Bad boys, bad boys whatcha gonna do?
Whatcha gonna do when they come for you?
Bad boys, bad boys whatcha gonna do?
Whatcha gonna do when they come for you? Nobody now give you no break
Police now give you no break
Not soldier man give you no break
Not even you idren now give you no breaks Bad boys, bad boys whatcha gonna do?
Whatcha gonna do when they come for you?
Bad boys, bad boys whatcha gonna do?
Whatcha gonna do when they come for you? Bad boys, bad boys whatcha gonna do?
Whatcha gonna do when they come for you?
Bad boys, bad boys whatcha gonna do?
Whatcha gonna do when they come for you? Why did you have to act so mean?
Don't you know you're human being?
Born of a mother with the love of a father
Reflections come and reflections go
I know sometimes you wanna let go
I know sometimes you want to let go Bad boys, bad boys whatcha gonna do?
Whatcha gonna do when they come for you?
Bad boys, bad boys whatcha gonna do?
Whatcha gonna do when they come for you? You're too bad, you're too rude
You're too bad, you're too rude Bad boys, bad boys whatcha gonna do?
Whatcha gonna do when they come for you?
Bad boys, bad boys whatcha gonna do?
Whatcha gonna do when they come for you?
You chuck it on that one
You chuck it on this one
You chuck it on your mother
And you chuck it on your father
You chuck it on your brother
And you chuck it on your sister
You chuck it on that one
And you chuck it on me
Bad boys, bad boys whatcha gonna do?
Whatcha gonna do when they come for you?"
do you believe in us,jon secada,1993," I tremble inside
Just thinking
About the world around us
Scared, can't help to wonder
Don't want any changes
'bout the way we feel
Do you know what I mean
Catch me I'm falling
Say it's gonna be alright
It's gonna be alright I know that we belong
Do you believe in us
Just give it half a chance Yes our love
Will still be strong
Girl I believe in us
I'll give you all I can Time has redefined the meaning of
Love, the way we know it
Love, the way we show it
I don't want any changes
When it comes to you
I like us the way it is
No matter what happens
Say it's gonna be alright
It's gonna be alright I know that we belong
Do you believe in us
Just give it half a chance Yes our love
Will still be strong
Girl I believe in us
I'll give you all I can I don't want any changes
Unless you want them to
Forever ain't long enough, baby
Nothing can change us
Say it's gonna be alright
It's gonna be alright I know that we belong
Do you believe in us
Just give it half a chance Yes our love
Will still be strong
Girl I believe in us
I'll give you all I can"
angel,jon secada,1993," I, I can't read the future
but I still want to hold you close
Right now, I need that from you
So give, me the morning
sharing another day with you
Is all I want to know And baby I, I've tried to forget you
But the light of your eyes, still
shines, you shine like an angel
A spirit that won't let me go I, I didn't want to tell you
things I didn't wanna know, myself
Was afraid to show
But you, you gave me a reason
a reason to face the truth
Oh, yes you did
To face the truth, face the truth, face the truth And baby I, I've tried to forget you
But the light of your eyes, still
shines, shines, shines like an angel
A spirit that won't let me go
Won't let me - go
Let go - of my heart And baby I, I've tried to forget you
But the light of your eyes, still
shines, like an angel
A spirit that won't let me go
No, won't let me go"
again,janet jackson,1993," I heard from a friend today
And she said you were in town
Suddenly the memories came back to me
In my mind How can I be strong I've asked myself
Time and time I've said
That I'll never fall in love with you again A wounded heart you gave
My soul you took away
Good intentions you had many
I know you did I come from a place that hurts
And God knows how I've cried
And I never want to return
never fall again Making love to you
Oh it felt so good and
Oh so right How can I be strong I've asked myself
Time and time I've said
That I'll never fall in love with you again So here we are alone again'
Didn't think it'd come to this
And to know it all began
With just a little kiss I've come too close to happiness
To have it swept away
Don't think I can take the pain
No never fall again Kinda late in the game and my heart is in
Your hands
Don't you stand there and then
Tell me you love
Me then leave again
Cause I'm falling in love with
You again Hold me
Hold me
Don't ever let me go
Say it just one time
Say you love me
God knows I do
Love you
Again"
boom shake the room,dj jazzy jeff  the fresh prince,1993," Boom! Shake the Room
Jazzy Jeff and the Fresh Prince 
yo back up now and give a brother room
the fuse is lit and I'm about to go boom
mercy mercy mercy me
my life is a cage but on stage I'm free
hyped up syched up ready for wil'in'
standing in a crowd of girls like an island
I see the one I wanna sic come here cutie
I flip 'em around and then I work that booty
work the body work work the body
slow down girl you're 'bout to hurt somebody
oh and yo let's get just one thing clear
there's only one reason why I came here
ya really done want me to tig-a-tig-a-tig-a tell ya wassup (go)
ya really done want me to tig-a-tig-a-tig-a tell ya wassup (go)
ya really done want me to tig-a-tig-a-tig-a tell ya wassup (go)
I came here tonight to hear the crowd go Chorus:
Boom! shake-shake-shake the room
Boom! shake-shake-shake the room
Boom! shake-shake-shake the room
tic-tic-tic-tic Boom! well yo are yall ready for me yet
(pump it up prince)
well yo are yall ready for me yet
(pump it up prince)
well yo are yall ready for me yet
(pump it up prince)
well here I go here I go here I here I go
yo
dance in the aisles when the prince steps to it
the rhyme is a football yall and I went and threw it
out in the crowd and yo it was a good throw
how do I know? because the crowd went hoooo
in response to the way that I was kicking it smooth and individual
rhymes always original
like the Dr. Jekyl man and this is my Hyde side
I am the driver and you're on a rap ride
so fellas (yeah)
are yall wit me (yeah)
I said fellas (yeah)
are yall wit me (yeah)
why don't you tell the girls what yall wanna do
ya wanna ooh-ahh-ahh-ahh-ahh--ooooh
that's right yo and I'm in the flow
so pump up the volume along with the tempo
I want everybody in the house to know
I came here tonight to hear the crowd go pump it up pump it up come on now
repeat 5X yeah, come on now here I go
the the f-f-f-f-fresh p-p-p-prince is who I am
so tell my mother that I never wrote a whack jam
but some times I get n-nervous and start to stutter
and I f-fumble every word for word I utter
so I just try to ch-ch-ch-ch-ch-chill
but it gets worse-a but worse-a but-but-but worse still
I need the c-c-c-crowd to k-k-k-kick into it
they help me calm down and I can get through it
so higher higher
get ya hands to the ceiling
let it go yall don't fight the feeling
mic in a strangle hold sweat pourin'
and like Jordan yo I'm scoring
yeah that's right yall and I am in the flow
so pump up the volume along with the tempo
many have died tryin' to stop my show
I came here tonight to here the crowd go"
