when she cries,restless heart,1993," The road I have traveled on
Is paved with good intentions
It's littered with broken dreams
That never quite came true When all of my hopes were dying
Her love kept me trying
She does her best to hide
The pain that she's been through ()
When she cries at night
And she doesn't think that I can hear her
She tries to hide
All the FEARS SHE FEELS INSIDE
So I pray this time
I can be the man that she deserves
'Cause I die a little each time
When she cries She's always been there for me
Whenever I've fallen
When nobody else believes
She'll be there by my side I don't know how she takes it
Just once I'd like to make it
Then there'll be tears of joy
That fill her loving eyes ()
So I pray this time
I can be the man that she deserves
'Cause I die a little each time
When she cries"
sweat a la la la la long,inner circle,1993," A la la la la long, a la la la la long long li long long long
c'mon
A la la la la long, a la la la la long long li long long long
hey
standing across the room
i saw you smile
said I want to talk to you-oo-oo
for a little while
But before i make my move
My emotions start running wild
my tongue gets tied
and that's no lie
looking in your eyes
looking in your big brown eyes
ooh yeah
and i've got this to say to you
Hey!
Girl I want to make you sweat
sweat till you can't sweat no more
and if you cry out
I'm gonna push it some, more, more
girl I want to make you sweat
sweat till you can't sweat no more
and if you cry out
I'm gonna push it
Push it, push it some more
A la la la la long, a la la la la long long li long long long
c'mon
A la la la la long, a la la la la long long li long long long
so I said to myself
Does she love me or not?
but the dreads done know
that love is his to get
with a little bit of this
and a little bit of that
my lyric goes on the attack
my tongue gets tied
and that's no lie
looking in you eyes
looking in your big brown eyes
ooh girl
and I've got this to say to you
hey!
Girl I want to make you sweat
sweat till you can't sweat no more
and if you cry out
I'm gonna push it some, more, more
girl I want to make you sweat
sweat till you can't sweat no more
and if you cry out
I'm gonna push it
Push it, push it some more
A la la la la long, a la la la la long long li long long long
ooh yeah
A la la la la long, a la la la la long long li long long long
one more time
A la la la la long, a la la la la long long li long long long
sing it
A la la la la long, a la la la la long long li long long long
hey
woo woo woo woo wee yeah
eyes
looking in your big brown eyes"
it was a good day,ice cube,1993," Break 'em
Just wakin' up in the mornin' gotta thank God
I don't know but today seems kinda odd
No barkin' from the dog, no smog And momma cooked a breakfast with no hog I got my grub on, but didn't pig out Finally got a call from a girl I wanna dig out
Hooked it up for later as I hit the do'
Thinkin' will I live another twenty-fo'
I gotta go 'cause I got me a drop top
And if I hit the switch, I can make the ass drop
Had to stop, at a red light
Lookin' in my mirror, not a jacker in sight
And everything is alright
I got a beep from Kim and she can fuck all night
Called up the homies and I'm askin' y'all
Which park, are y'all playin' basketball?
Get me on the court and I'm trouble Last week fucked around and got a triple double
Freakin' niggaz everyway like M.J I can't believe, today was a good day
(shit)
Drove to the pad and hit the showers
Didn't even get no static from the cowards
'Cause just yesterday them fools tried to blast me
Saw the police and they rolled right past me
No flexin', didn't even look in a nigga's direction
As I ran the intersection
Went to Short Dog's house, they was watchin' yo! MTV Raps
What's the haps on the craps?
Shake 'em up, shake 'em up, shake 'em up, shake 'em
Roll 'em in a circle of niggaz and watch me break 'em
With the seven, seven-eleven, seven-eleven Seven even back do' Lil' Joe I picked up the cash flow
Then we played bones, and I'm yellin' domino Plus nobody I know got killed in South Central L.A Today was a good day
(shit)
Left my nigga's house paid
Picked up a girl been tryin' to fuck since the 12th grade
It's ironic, I had the brew, she had the chronic
The lakers beat the Supersonics
I felt on the big fat fanny
Pulled out the jammy and killed the punanny
And my dick runs deep, so deep
So deep put her ass to sleep
Woke her up around one
She didn't hesitate to call Ice Cube the top gun
Drove her to the pad and I'm coastin'
Took another sip of the potion hit the three-wheel motion I was glad everything had worked out
Dropped her ass off and then chirped out
Today was like one of those fly dreams
Didn't even see a berry flashin' those high beams No helicopter looking for a murder Two in the mornin' got the Fatburger
Even saw the lights of the Goodyear Blimp
And it read, ""Ice Cube's a pimp""
Drunk as hell but no throwin' up
Half way home and my pager still blowin' up
Today I didn't even have to use my A.K
I got to say it was a good day
(shit)
Hey wait, wait a minute Pooh, stop this shit
What the fuck I'm thinkin' about?"
more and more,captain hollywood project,1993," More and more and more
I don't know where we're going to
More and more and more
There's so much we don't wanna do
'Cause without we cheat and we learn
From each and every heart affair
It's without we cheat and we hurt
Till somebody's in despair Boom, keep in tune
Hollywood will soon left the point
Right to the point smokin'
Like it's a joint, makin'
Ain't got time to be fakin'
It's my turn and I'm takin'
Everything without shakin'
Yo here with the bacon More and more and more
I don't know where we're going to
More and more and more
There's so much we don't wanna do
'Cause without we cheat and we learn
From each and every heart affair
It's without we cheat and we hurt
Till somebody's in despair More and more and more
More and more and more More and more bam, don't give a damn
Pump the music and jam
There's no time for the problem
Not a thought to some
But just make sure you get it
Show the fella's you with it
Being prompt you get it
Never will you forget it More and more and more
I don't know where we're going to
More and more and more
There's so much we don't wanna do
'Cause without we cheat and we learn
From each and every heart affair
It's without we cheat and we hurt
Till somebody's in despair More and more and more
More and more and more"
what is love,haddaway,1993," What is love?
Baby, don't hurt me
Don't hurt me no more
Baby, don't hurt me
Don't hurt me no more
What is love?
Yeah, yeah
(Ooh, ooh)
I don't know why you're not there.
I give you my love, but you don't care
So what is right?
And what is wrong?
Gimme a sign
What is love?
Baby, don't hurt me
Don't hurt me no more
What is love?
Baby, don't hurt me
Don't hurt me no more
(Whoa, whoa, whoa, whoa, oh-whoa, whoa, ohh, ooh)
(Whoa, whoa, whoa, whoa, oh-whoa, whoa, ohh, ooh)
Oh, I don't know, what can I do?
What else can I say, it's up to you
I know we're one
Just me and you
I can't go on
What is love?
Baby, don't hurt me
Don't hurt me no more
What is love?
Baby, don't hurt me
Don't hurt me no more
(Whoa, whoa, whoa, whoa, oh-whoa, whoa, ohh, ooh)
(Whoa, whoa, whoa, whoa, oh-whoa, whoa, ohh, ooh)
What is love?
(Ooh, ooh, ooh)
What is love?
(Ooh, ooh, ooh)
What is love?
Baby, don't hurt me
Don't hurt me no more
Don't hurt me
Don't hurt me
I want no other, no other lover
This is our life, our time
When we are together, I need you forever
Is it love?
What is love?
Baby, don't hurt me
Don't hurt me no more
What is love?
Baby, don't hurt me
Don't hurt me no more
Yeah
(Whoa, whoa, whoa, whoa, oh-whoa, whoa, ohh, ooh)
(Whoa, whoa, whoa, whoa, oh-whoa, whoa, ohh, ooh)
What is love?
Baby, don't hurt me
Don't hurt me no more
What is love?
Baby, don't hurt me
Don't hurt me no more
(Huh-huh, huh-huh)
Baby, don't hurt me
Don't hurt me no more
(Huh-huh, huh-huh)
Baby, don't hurt me
Don't hurt me no more
What is love?"
to love somebody,michael bolton,1993," There's a light
A certain kind of light
That never shown on me
I want my life to be
To lived with you
To lived with you
There's a way
Everybody says To do each and every little thing
But what does it bring
If i ain't got you
i ain't got you Baby you don't know what it's like Baby you don't know what it's like
To love somebody
To love somebody
The way I love you
In my mind
I see your face again I know my frame of mind
You ain't got to be so blind But I'm blind
So very blind I'm a man
Can't you see what i am
I live and breathe for you But what good does it do If i ain't got you
If i ain't got you, baby
You don't know what it's like
Baby you don't know what it's like To love somebody
To love somebody
The way I love you
You don't know what it's like
Baby you don't know what it's like
To love somebody
To love somebody
To love somebody
To love somebody
You don't know
To love somebody
The way i love you
You don't know
You don't know
To love somebody
To love somebody
You don't know
Oohooo...
To love somebody
To love somebody
The way i love you"
give it up turn it loose,en vogue,1993," I believe in yesterday
I believe in yesterday spoken
What's the problem?
You keep comin' in and keep comin' out and singin flat
I'm sorry, I'm sorry
What's wrong? What's wrong?
You're not concentrating
Yes, I am concentrating
No, you're not
I'm sorry, let's just do it again
Nonono, uh uh. What's the problem
There's no problem.
Dawn, what's wrong?
There's nothing wrong, Terry.
Kevin.
Mmhm
Please don't tell me it's Kevin.
Mmhm
Ew, Kevin Swahili, I knew it! He's got cooties.
And he's seeing Tamika right now
And everybody else
He is not seeing Raneka
He is.
How you know?
Wait a minute guys.
Wait wait wait. You guys, we should not attack her, it sounds like it's
serious because we can't concentrate and get this right. So, let's deal with
the problem.
You see, I've been through this myself, and, let's talk.
And it goes a little something like this - hit it.
Mmm... Verse 1:
Baby girl (unfair but true)
Can love him once but not twice
Who plays games with no rules (a fool)
Tears for fears (are no surprise)
Happens almost every time
Love knocks you on your behind
(Loved you hard, loved you long, now his love is gone)
Love 'em and leave 'em (is the rule of most dogs)
You must be strong
Stand up on your own
Take control of your life
I've seen it time and time again
It's not worth it, no
Don't be down and miserable
You and only you
Can bring yourself around Chorus:
Give it up, turn it loose
Oh, if it don't wantcha, you don't need 'em, girl, yeah
Give it up, turn it loose
Oh, you got to have Verse 2:
Fact of life (so sad but true)
Love can often hurt you
Leaving scars most of your life (nightmares can haunt you)
But fairytales of love, can come true
Both play tricks on your mind
(You'll be fine, take this time, to find piece of mind)
Sooner or later (bad feelings will die)
You must be strong
Don't blame it all on love
In time good things will come
I've seen time and time again
It's not worth it, no no
Don't be down and miserable
You and only you
Can bring yourself around Chorus:
Give it up, turn it loose
Oh, if it don't wantcha, you don't need 'em, girl... yeah
Give it up, turn it loose
Oh, you got to have
(Give it up)
Give it up
(Give up)
Give it up
(Give up)
Give it up
Give it up turn it loose
Turnin' it loose, baby
(repeat till fade)"
alright,kris kross,1993," Just kick a little somethin' for them cars that be bumpin'
somethin' real smooth
you can just ride to
tell me how you feel
here we go...
the day seems nice and bright and everything feels alright
went to school without a fool tryin' to pick a fight
i was loced out kris kross shirts and khakis
lookin' and feelin' like nothin' but a mac
see, the bell rang and i got my dash
fellin' good cause it was the last day of school and i passed
no moms trippin' so me and my mom went dippin'
to celebrate the fact that i wasn't slippin'
the downtown scene was packed
people screamin' from they ride to my ride and to the mac
i says ""what i am is what i am is who i be""
and yall should have seen how they was tryin' to get to me
cool, cause dissin' and no pay
they're the reason why we are who we are to this very day
and all that love keeps me and chris tight
long as we give some love back everything's alright.
now everything feels alright when i'm rollin' through my hood
and i see the one that used to do the dirt then turned good
little kids try to be like me with the braids, the shades, some pants,
and some nikes, g
and yet more letters, and the letters sayin'
""i'm your number one fan could you write me back man?""
yesssss...
i try to pass 'em my autograph
i try to do as many as i can
now it feels good when i'm rollin' through my hood
ain't nobody dissin' and a nigga thinks he's too good
cause i'm down like four flat tires
just a little nappy headed kid from the proj.
showin' i can do right and not do wrong
rappers and the beejees comin' up strong
and we ain't got no love for the side
we only love those who love us back
right?
now people seem to think what i do is a blast
cause i'm always on the road and i'm makin' some cash
but they don't know
really know
the pressure it is for some kids tryin to make it in this here biz
early mornin' interviews then we step to school
step from school
back to interviews then it's on to other dues
so, warm it up chris
i said ""ya warm it up chris""
that's what i was born to do
now throw your hands in the air and wave from side-to-side
if the feelin' thatcha feelin' is the feelin' of pride
see, i ain't come out wack i come out right
unlike those 'mose who tried to pass the mike
it's the daddy mac
big thing
everything is real but you wanna dis cause a nigga sold a couple mill.
look here, ya can't say nothin' if ya last in a line
so when you dis it just lets me know i'm on your mind
and it's alright"
check yo self,ice cube featuring das efx,1993," Intro Yeah! Word is bond!
Das EFX in this yaknowhatI'msayin
Straight from the sewer, word is bond!
Yeah! Yah! Ah - yeah! We doin this with my nigga
Where my nigga? Ice Cube in the motherfucker
Word is bond! (Yeah!) You better check yo self before you wreck yo self
Cos I'm bad for your health, I come real stealth
Droppin bombs on ya moms, fuck car alarms
Doin foul crime, I'm that nigga wit'cha Alpine
Sold it for a six - o, always let tricks know
And friends know, we got the indo
No I'm not a sucker, sittin in a House of Pain
And no I'm not the butler, I'll cut ya (Uh!)
Headbutt ya, you say you can't touch this
And I wouldn't touch ya, in fact mothafuck ya
Here to let you know boy, oh boy
I make dough but don't call me DoughBoy
This ain't no fuckin motion picture
A guy or bitch - a, I'll get wit'cha
And hit ya, takin that yack to the neck
So you better run a check {Das} So come on and chickity - check yo self before you wreck yo self
Chickity - check yo self before you wreck yo self
Yeah, come on and check yo self before you wreck yo self
{Ice} Cause shotgun bullets are bad for your health Mic - mic - microphone check (One, two! Check it!)
{2X} Tricks wanna step to Cube and then they get played
Cause they bitchmade pullin out a switchblade
That's kinda trifle, cause that's a knife - ho
AK - 47, assault rifle
Hold the fifty, I'm nifty, pow
I gotta new style, ""WATCH OUT NOW!""
I hate motherfuckers claimin that they foldin bank
But steady talkin shit in the holding tank
First you wanna step to me
Now your ass screamin for the deputy
They send you to Charlie - Baker - Denver row
Now they runnin up in ya slow
You're gone, used to be the Don Juan (Check that shit out!)
Now your name is just Twan
Switch it, snap it, rollin your eyes and neck
You better run a check {Das} So chickity - check yo self before you wreck yo self
Come on and check yo self before you wrickity - wreck yo self
So chickity - check yo self before you wreck yo self
{Ice} Cause big dicks up yo ass is bad for yo health If you're foul, you better run a make on that license plate
You coulda had a V8
Instead of a tre - eight slug to the cranium (POOOOOW!)
I got six and I'm aimin em
Will I shoot or keep you guessin
Cause fuck you and that shit ya stressin
Bitch, get off the wood, you're no good
There goes the neighbourhood hooker (Slut!)
Go ahead and keep your drawers
Givin up the claps and who needs applause
At a time like this, pop the coochie and ya dead
The bitch is a Miami Hurricane head
Sprung, niggaz call her 'Lips and Lungs'
Nappy dugout, get the fuck out
Cause women like you gets no respect
Bitch, you better run a check {Das} So chickity - check yo self before you wreck yo self
So chickity - check yo self before you wreck yo self
Come on and check yo self before you wrickity - wreck yo self
{Ice} Cause bitches like you is bad for my health"
fields of gold,sting,1993," You'll remember me when the west wind moves
Upon the fields of barley
You'll forget the sun in his jealous sky
As we walk in fields of gold So she took her love
For to gaze a while
Upon the fields of barley
In his arms she fell as her hair came down Among the fields of gold
Will you stay with me?
Will you be my love?
Among the fields of barley We'll forget the sun in his jealous sky
As we lie in fields of gold
See the west wind move like a lover so
Upon the fields of barley Feel her body rise when you kiss her mouth
Among the fields of gold
I never made promises lightly
And there have been some that I've broken
But I swear in the days still left We'll walk in fields of gold
We'll walk in fields of gold
Many years have passed since those summer days
Among the fields of barley See the children run as the sun goes down
Among the fields of gold
You'll remember me when the west wind moves
Upon the fields of barley
You can tell the sun in his jealous sky
When we walked in fields of gold
When we walked in fields of gold
When we walked in fields of gold"
ooh child,dino,1993," Ooh-oo child
Things are gonna get easier
Ooh-oo child
Things'll get brighter
Ooh-oo child
Things are gonna get easier
Ooh-oo child
Things'll get brighter
Some day, yeah
We'll put it together and we'll get it all done
Some day
When your head is much lighter
Some day, yeah
We'll walk in the rays of a beautiful sun
Some day
When the world is much brighter
Ooh-oo child
Things are gonna be easier
Ooh-oo child
Things'll be brighter
Ooh-oo child
Things are gonna be easier
Ooh-oo child
Things'll be brighter
Some day, yeah
We'll put it together and we'll get it all done
Some day
When your head is much lighter
Some day, yeah
We'll walk in the rays of a beautiful sun
Some day
When the world is much brighter
Some day, yeah
We'll put it together and we'll get it all done
Some day
When your head is much lighter
Some day, yeah
We'll walk in the rays of a beautiful sun
Some day
When the world is much brighter
Ooh-oo child
Things are gonna get easier
Ooh-oo child
Things'll get brighter
Ooh-oo child
Things are gonna get easier
Ooh-oo child
Things'll get brighter
Right now, right now
(you just wait and see how things are gonna be)"
faithful,go west,1993," Oooooooh, I will Don't cry baby
Kiss me and say farewell
Nothing's gonna break the spell
And if you're thinking time will tell me girl
I want you to know. Every minute of every single day
Even when I'm miles away (miles away)
I'll keep the promises I made
I want you to know. I will be faithful to my lover's prayer
Faithful - and I don't care
If the world around us gives up on love
I will make you see
You can count on me
I will be faithful -
Faithful to my lover's prayer
To my lover's prayer Listen baby
You can lean on me
Though we sail on stormy seas
Nothing good comes easily
But I, I won't let you down. I will be faithful to my lover's prayer
Faithful - and I don't care
If the world around us gives up on love
I will make you see
You can count on me
I will be faithful -
Faithful to my lover's prayer Baby you can lean on me
You can lean on me
Baby you can lean on me
You can lean on me
Baby you can lean on me
You can lean on me
Baby you can lean on me
You can lean on me. Trust me baby this is not goodbye
There's no need for you to cry
What we've got's too strong
To be denied, yeah I will be faithful to my lover's prayer
Faithful - and I don't care
If the world around us gives up on love
I will make you see
You can count on me
I will be faithful to my lover's prayer
gonna be faithful to the dream we share, to the dream we share
If the world around us gives up on love
I will make you see
You can count on me
I will be faithful
Faithful to my lover's prayer
ooooh ooooh faithful, awww
faithful, faithful to the dream we share
ooooh ooooh faithful
gonna be faithful yeah yeah yeah yeah yeah
ooooh ooooh faithful, oooh yeah
faithful, faithful
oooh oooooh faithful baby you can lean on me
ooooh ooooh faithful
baby you can lean on me
ooooh ooooh faithful"
reason to believe,rod stewart,1993,
break it down again,tears for fears,1993," Here we go! Break it down again
So those are my dreams
And these are my eyes
Stand tall like a man
Headstrong like a horse When it's all mixed up
Better break it down In the world of secrets
In the world of sound It's in the way you're always hiding from the light
See for yourself you have been sitting on a time bomb
No revolution maybe someone somewhere else
Could show you something new about you and your inner song
And all the love and all the love in the world
Won't stop the rain from falling
Waste seeping underground
(Break it down again)
I want to break it down
(Break it down again) Break it down again
So those are my schemes
And these are my plans
Hot tips for the boys
Fresh news from the force When it's all mixed up
Better break it down In the world of silence
In the world of sound ""No sleep for dreaming"" say the architects of life
Big bouncing babies, bread and butter can I have a slice
They make no mention of the beauty of decay
Blue, yellow, pink umbrella save it for a rainy day
And all the love and all the love in the world
Won't stop the rain from falling
Waste seeping underground
(Break it down again)
I want to break it down
(Break it down again) Horsin' around
Pray to power
Play to the crowd with your big hit sound
And they won't simmer, won't simmer, won't simmer down
Play to the crowd
Play to the crowd
Play yeah yeah It's in the way you're always hiding from the light
Fast off to heaven just like Moses on a motorbike
No revolution maybe someone somewhere else
Could show you something new to help you
With the ups and downs
(Break it down again)
I want to break it down
(Break it down again)
Break it down again
(Break it down again)
(Break it down again)
Here we go!
Break it down again
No more sleepy dreaming
No more building up
It is time to dissolve
Break it down it again
No more sleepy dreaming"
three little pigs,"green jell""y",1993," Why don't you sit right back?
And I, I may tell you a tale
A tale of three little pigs
And a Big, Bad
Wolf
Well, the first little piggy, well, he was kinda hick
He spent most of his days just a dreamin' of the city And then one day, he bought a guitar
He moved to Hollywood to become a star
But living on the farm, he knew nothing of the city
Built his house out of straw, what a pity And then one day, jammin' on some chords
Along came the wolf, knocking on his door
Little pig, little pig, let me in
Not by the hair of my chinny, chin, chin Little pig, little pig, let me in
Not by the hair of my chinny, chin, chin
Well, I'm huffin', I'm puffin', I'll blow your house in
Huffin', puffin', blow your house in Huffin', puffin', blow your house in
Huffin' and a puffin' and I'll blow your house in
Well, the second little piggy, well, he was kinda stoked
He spent most of his day just in ganja smokin' Huffin' and a puffin' down on Venice Beach
Getting paid money for religious speech
He built his shelter from what he garbage picked
Mostly made up of old cans and sticks Then one day he was cranking out Bob Marley
And along came the wolf on his big, bad Harley
Little pig, little pig, let me in
Not by the hair of my chinny, chin, chin Little pig, little pig, let me in
Not by the hair of my chinny, chin, chin
Well, I'm huffin', I'm puffin', I'll blow your house in
Huffin', puffin', blow your house in Huffin', puffin', blow your house in
Huffin' and a puffin' and I'll blow your house in
Well, the third little piggy, the grade A student
His daddy was a rock star named Pig Nugent Earned his Masters Degree from Harvard College
Built his house from his architect knowledge
A tri-level mansion, Hollywood Hills
Daddy's rock stardom, paid for the bills And then one day came the old house smasher
The big, bad wolf, the little piggy slasher
Little pig, little pig, let me in
Not by the hair of my chinny, chin, chin Little pig, little pig, let me in
Not by the hair of my chinny, chin, chin
Well, I'm huffin', I'm puffin', I'll blow your house in
Huffin', puffin', blow your house in Huffin', puffin', blow your house in
Huffin' and a puffin' and I'll blow your house in
Well, the big bad wolf
Well, he huffed and he puffed, all that he could
And low and behold the little piggy's house stood ""It's made out of concrete"", the little piggy shouted
The wolf just frowned, as he pouted
So, they called nine-eleven, like any piggy would
They sent out Rambo just as fast as they could Yo, wolf-face, I'm your worst nightmare
Your ass is mine
Well, the wolf fell dead as you can plainly see
So, that's to end the story for you and me
If you still give a listen, you just may
Hear a big wolf or little piggy say
Little pig, little pig, let me in
Not by the hair of my chinny, chin, chin
Little pig, little pig, let me in
Not by the hair of my chinny, chin, chin
Well, I'm huffin', I'm puffin', I'll blow your house in
Huffin', puffin', blow your house in
Huffin', puffin', blow your house in
Huffin' and a puffin' and I'll blow your house in
And the moral of the story is
A band with no talent can easily amuse
Idiots with a stupid, puppet show"
