twisted,keith sweat,1996," Oh, yeah, baby
You got to make your mind up
Yeah, Kut Klose, help me out You know you are my lover
(You know you want my lovin', baby)
You got me twisted over you
(Girl, you got me twisted over you) I know I got what you need
(I got what you need right here, baby)
So what you wanna do? Baby, baby, I know
Baby, I love you so
But you don't feel like I do
Tell me what can I do? But I gotta be strong
(But I gotta be strong)
Did me wrong
(Girl, you did me wrong) When I thought that we were really down
(I thought we were down)
So you say you want me
(Now, you say you want me, girl) Make up your mind
(Ooh, make up your mind)? Cause I? m not gonna be here for long
(I? m not gonna be here for long)
You know you are my lover (You know you want my lovin', baby)
You got me twisted over you
(Girl, you got me twisted over you)
I know I got what you need (I got what you need right here, baby)
So what you wanna do?
Baby, baby in time (Baby, in time)
Baby, I know you'll find
(I know you'll find)
That what you needed was here (Oh, no, no, no, no, no)
Think about it, my dear
But I gotta be strong (But I gotta be strong)
Did me wrong
(Girl, you did me wrong)
When I thought that we were really down (I thought we were down)
So you say you want me
(Now, you say you want me, girl)
Make up your mind (Ooh, make up your mind) Cause I'm not gonna be here for long
(I'm not gonna be here for long)
You know you are my lover
(You know you want my lovin', baby) You got me twisted over you
(Girl, you got me twisted, baby)
I know I got what you need
(I got everything you need tonight) So what you wanna do?
(Break it on down)
You got me twisted, thinkin'
About the way that things used to be When it was you and me, girl, I was so free
See, you had my heart from the start like Cupid
And I was just downright foolish and stupid
But now, I know the reason for the pain and the headaches
You left me all alone, now, I can't even concentrate I guess I? ll wait for the day until you come back
Because my heart is where your love is at, you got me twisted
You know you are my lover
(You know you are my lovin', baby) You got me twisted over you
(Girl, you got me twisted, baby)
I know I got what you need
(I got everything you need tonight) So what you wanna do?
(What are you gonna do, baby?)
You know you are my lover
(You know I can make you feel
Real good, if you let me, baby)
You got me twisted over you
(Girl, you got me twisted, baby)
I know I got what you need
(I got everything you need tonight)
So what you wanna do?
(What are you gonna do, baby?)
You know you are my lover
(You know, you know, you want my lovin', baby)
You got me twisted over you
(Girl, you got me twisted, baby)
I know I got what you need
(I've got everything your body needs)
So what you wanna do?
(What are you gonna do? Tell me, baby)
You know you are my lover"
cmon n ride it the train,quad city djs,1996," Woo woo Come on, ride the train, hey, ride it, woo woo
Come on, ride the train, hey, ride it, woo woo
Come on, ride the train, woo woo, hey
Ride it, woo woo
Come on, ride the train
Woo woo, hey, ride it, woo woo
Come on, ride the train
It's the choo choo, ride it, woo woo
Come on, ride the train, it's the choo choo train
Come on, ride the train, it's the choo choo
Ride it, woo woo
Come on, ride the train, it's the choo choo train Ah, ah, ah, ah, ah
I think I can, I think I can
I think I can, I think I can
Way deep down south, well we play this game
It's them Quad City D.J.'s and you
We call it ""the train""
So if you wanna ride your thing
Just come on down the train
We gonna rock, ooh, Lord, just jump aboard, baby
So get your next of kin, your sister and your friend
Pack it up now, choo choo, ride on this, choo choo
And, boo, you need to stop faking, and come on with me
I wanna take you home with me, to be alone with me
And I can see you wanna hide it, come on, just divide it
And please don't knock it, until you ride it
So to all of you girls, you know, I'm calling your name
Michelle, Tamika and Tanya
Wanna ride this train, ride out now Come on, ride the train, hey, ride it, woo woo
Come on, ride the train, hey, ride it, woo woo
Come on, ride the train, woo woo, hey
Ride it, woo woo
Come on, ride the train
Woo woo, hey, ride it, woo woo
Come on, ride the train
It's the choo choo, ride it, woo woo
Come on, ride the train, it's the choo choo train
Come on, ride the train, it's the choo choo
Ride it, woo woo
Come on, ride the train, it's the choo choo train If you feel like dancing, well come on, it's up to you
We got the sound to keep you getting down, down
The train is coming through Ah, ah, ah, ah, ah
I think I can, I think I can
I think I can, I think I can
Way deep down south, well we play this game
It's them Quad City D.J.'s and you
We call it ""the train""
So if you wanna ride your thing
Just come on down the train
We gonna rock, ooh, Lord, just jump aboard, baby
So get your next of kin, your sister and your friend
Pack it up now, choo choo, ride on this, choo choo
And, boo, you need to stop faking, and come on with me
I wanna take you home with me, to be alone with me
And I can see you wanna hide it, come on, just divide it
And please don't knock it, until you ride it
So to all of you girls, you know, I'm calling your name
Michelle, Tamika and Tanya
Wanna ride this train, ride out now Ah, ah, ah, ah, ah
I think I can, I think I can
I think I can, I think I can
Way deep down south, well we play this game
It's them Quad City D.J.'s and you
We call it ""the train""
So if you wanna ride your thing
Just come on down the train
We gonna rock, ooh, Lord, just jump aboard, baby
So get your next of kin, your sister and your friend
Pack it up now, choo choo, ride on this, choo choo
And, boo, you need to stop faking, and come on with me
I wanna take you home with me, to be alone with me
And I can see you wanna hide it, come on, just divide it
And please don't knock it, until you ride it
So to all of you girls, you know, I'm calling your name
Michelle, Tamika and Tanya
Wanna ride this train, ride out now I can smell them tranquil breezes from a mile away
Graduated from Boone up to Alize
Baby, you looking tough to death
Got your weave done right, it's on so tight
Now it's on tonight, yeah, yeah
Right about now it's about that time for me to holler
Girl, I wanna waller in the back of my impala
Woo, don't need no tickets for this thing
Just jump on in, let me hit them switches on the train
And it ain't no thing, it's all the same
Get on the train tracks
Here we go, so get on the floor
And put a hump in your back
So pack your bags, come on, get ready, say what?
We're coming through your town
Move your arm up and down
And make that choo choo sound, like this
Ride that choo choo, woo woo
Come on it's the choo choo, woo woo
Come on it's the choo choo train If you feel like dancing, well come on, it's up to you
We got the sound to keep you getting down, down
The train is coming through Ah, ah, ah, ah, ah
I think I can, I think I can
I think I can, I think I can
Way deep down south, well we play this game
It's them Quad City D.J.'s and you
We call it ""the train""
So if you wanna ride your thing
Just come on down the train
We gonna rock, ooh, Lord, just jump aboard, baby
So get your next of kin, your sister and your friend
Pack it up now, choo choo, ride on this, choo choo
And, boo, you need to stop faking, and come on with me
I wanna take you home with me, to be alone with me
And I can see you wanna hide it, come on, just divide it
And please don't knock it, until you ride it
So to all of you girls, you know, I'm calling your name
Michelle, Tamika and Tanya
Wanna ride this train, ride out now Ah, ah, ah, ah, ah
I think I can, I think I can
I think I can, I think I can
Way deep down south, well we play this game
It's them Quad City D.J.'s and you
We call it ""the train""
So if you wanna ride your thing
Just come on down the train
We gonna rock, ooh, Lord, just jump aboard, baby
So get your next of kin, your sister and your friend
Pack it up now, choo choo, ride on this, choo choo
And, boo, you need to stop faking, and come on with me
I wanna take you home with me, to be alone with me
And I can see you wanna hide it, come on, just divide it
And please don't knock it, until you ride it
So to all of you girls, you know, I'm calling your name
Michelle, Tamika and Tanya
Wanna ride this train, ride out now"
missing,everything but the girl,1996," I step off the train
I'm walking down your street again
And past your door, but you don't live there anymore
It's years since you've been there
Now you've disappeared somewhere, like outer space
You've found some better place And I miss you, like the deserts miss the rain
And I miss you, like the deserts miss the rain Could you be dead?
You always were two steps ahead, of everyone
We'd walk behind while you would run
I look up at your house
And I can almost hear you shout down to me
Where I always used to be And I miss you, like the deserts miss the rain
And I miss you, like the deserts miss the rain Back on the train, I ask why did I come again?
Can I confess, I've been hanging round your old address?
And the years have proved
To offer, nothing since you've moved
You're long gone, but I can't move on And I miss you, like the deserts miss the rain
And I miss you, like the deserts miss the rain
And I miss you I step off the train
I'm walking down your street again
And past your door, I guess you don't live there anymore
It's years since you've been there
Now you've disappeared somewhere, like outer space
You've found some better place And I miss you,
And I miss you,
You found some better place And I miss you, like the deserts miss the rain
And I miss you, yeah, like the deserts miss the rain
And I miss you, and I miss you
Like the deserts miss the rain
And I miss you, yeah, like the deserts miss the rain
The deserts miss the rain
Like the deserts miss the rain
Like the deserts miss the rain,
Like the deserts miss the rain
And I miss you, yeah, like the deserts miss the rain"
ironic,alanis morissette,1996," An old man turned ninety-eight
He won the lottery and died the next day
It's a black fly in your Chardonnay
It's a death row pardon two minutes too late
And isn't it ironic... don't you think It's like rain on your wedding day
It's a free ride when you've already paid
It's the good advice that you just didn't take
Who would've thought... it figures Mr. Play It Safe was afraid to fly
He packed his suitcase and kissed his kids goodbye
He waited his whole damn life to take that flight
And as the plane crashed down he thought
""Well isn't this nice..."" And isn't it ironic... don't you think
It's like rain on your wedding day
It's a free ride when you've already paid
It's the good advice that you just didn't take
Who would've thought... it figures Well life has a funny way of sneaking up on you
When you think everything's okay and everything's going right
And life has a funny way of helping you out when
You think everything's gone wrong and everything blows up
In your face A traffic jam when you're already late
A no-smoking sign on your cigarette break
It's like ten thousand spoons when all you need is a knife
It's meeting the man of my dreams And then meeting his beautiful wife
And isn't it ironic... don't you think
A little too ironic... and, yeah, I really do think...
It's like rain on your wedding day
It's a free ride when you've already paid
It's the good advice that you just didn't take
Who would've thought... it figures
Life has a funny way of sneaking up on you
Life has a funny, funny way of helping you out
Helping you out"
exhale shoop shoop,whitney houston,1996," Everyone falls in love sometime
Sometimes it's wrong
And sometimes it's right
For every win Someone must fail
But there comes a point when
When we exhale, yeah, yeah, say
Shoop, shoop, shoop, shoop be doop Shoop, shoop, shoop be doop
Shoop, shoop, shoop be doop
All you gotta do is say shoop be doop
(Shoop) Shoop de doop (Shoop be doo) Shoop, shoop, shoop be doop (My love, uh)
Shoop, shoop, shoop be doop
Sometimes you'll laugh
Sometimes you'll cry Life never tells us the when's or why's
When you've got friends to wish you well
You'll find your point when you will exhale, yeah, yeah, say
Shoop, shoop, (shoop be doo) shoop be doop (Shoop, shoop, shoop) shoop be doop
Shoop, shoop, (shoop be, shoop be, shoop be)
Say shoop, say shoop, say shoop be, say shoop ooh, say shoop be
Shoop uh be doop
Oh, hearts are often broken when there are words unspoken
In your soul there's answers to your prayers
If you're searching for a place you know
A familiar face, somewhere to go
You should look inside yourself
You're halfway there
Sometimes you'll laugh
And sometimes you'll cry
Life never tells us
The when's or why's
But when you've got friends to wish you well
You'll find your point when you will exhale, yeah
Say shoop be
(Shoop, shoop) Shoop be
Shoop be, shoop be, shoop be
(Shoop, shoop) Shoop be doop...
Doo, doo, shoop be, shoop be
Things alright you can say
Shoop, shoop (oh), shoop, shoop be doop"
follow you down  til i hear it from you,gin blossoms,1996," I didn't ask
They shouldn't have told me
At first I'd laugh, but now
It's sinking in fast
Whatever they've sold me Well baby I don't want to take advice from fools
I'll just figure everything is cool
Until I hear it from you It gets hard
The memory's faded
Who gets what they say
It's likely they're just jealous and jaded Well maybe I don't want to take advice from fools
I'll just figure everything is cool
Until I hear it from you
Until I hear it from you I can't let it get me off
Or break up my train of thought
As far as I know, nothing's wrong
Until I hear it from you Still thinking about not living without it
Outside looking in
Til we're talking about it, not stepping around it
Maybe
I don't want to take advice from fools
I'll just figure everything is cool
Until I hear it from you (hear it from you)
Until I hear it from you (hear it from you)
Until I hear it from you (hear it from you)
Until I hear it from you
Until I hear it from you
Until I hear it from you (won't take advice from fools)
Ooh (I'll figure everything is cool)
Until I hear it from you (won't take advice from fools)
Ooh (I'll figure everything is cool)
Until I hear it from you"
sittin up in my room,brandy,1996," Seems like ever since, the first day we met
There is no one else I think of more than you
Can't seem to forget, can't get you out my head
Cause the verdicts in I'm crazy over you
How can one be down, tell me where to start
Cause everytime you smile, I feel tremors in my heart
I have but one concern, how can I get with you
Til my day comes, here's what I'm gonna do Be sittin up in my room
Back here thinkin bout you
I must confess, I'm a mess for you
Be sittin up in my room
Back here thinkin bout you
I'm just a mess with a thing for you Pray that you'll invest, in my happiness
All it takes is just one simple call from you
Turn my heart around, if I'm making ground
Pretty baby please, tell me if I'm getting through
Tell me what is up
You see I need to know
Tell if I'm far, or if I'm getting close
I have but one concern, and that one concern is you
Til I'm with you, here's what I'm gonna do Be sittin up in my room
Back here thinkin bout you
I must confess, I'm a mess for you
Be sittin up in my room
Back here thinkin bout you
I'm just a mess with a thing for you How can one be down, tell me where to start
Cause everytime you smil, I feel tremors in my heart
I have but one concern, how can I get with you
Til my day comes, here's what I'm gonna do Be sittin up in my room
Back here thinkin bout you
I must confess, I'm a mess for you
Be sittin up in my room
Back here thinkin bout you
I'm just a mess with a thing for you"
its all coming back to me now,celine dion,1996," There were nights when the wind was so cold
That my body froze in bed
If I just listened to it
Right outside the window
There were days when the sun was so cruel
That all the tears turned to dust
And I just knew my eyes were
Drying up forever
I finished crying in the instant that you left
And I can't remember where or when or how
And I banished every memory you and I had ever made
But when you touch me like this
And you hold me like that
I just have to admit
That it's all coming back to me
When I touch you like this
And I hold you like that
It's so hard to believe but
It's all coming back to me
(It's all coming back, it's all coming back to me now)
There were moments of gold
And there were flashes of light
There were things I'd never do again
But then they'd always seemed right
There were nights of endless pleasure
It was more than any laws allow
Baby Baby
If I kiss you like this
And if you whisper like that
It was lost long ago
But it's all coming back to me
If you want me like this
And if you need me like that
It was dead long ago
But it's all coming back to me
It's so hard to resist
And it's all coming back to me
I can barely recall
But it's all coming back to me now
But it's all coming back
There were those empty threats and hollow lies
And whenever you tried to hurt me
I just hurt you even worse
And so much deeper
There were hours that just went on for days
When alone at last we'd count up all the chances
That were lost to us forever
But you were history with the slamming of the door
And I made myself so strong again somehow
And I never wasted any of my time on you since then
But if I touch you like this
And if you kiss me like that
It was so long ago
But it's all coming back to me
If you touch me like this
And if I kiss you like that
It was gone with the wind
But it's all coming back to me
(It's all coming back, it's all coming back to me now)
There were moments of gold
And there were flashes of light
There were things we'd never do again
But then they'd always seemed right
There were nights of endless pleasure
It was more than all your laws allow
Baby, Baby, Baby
When you touch me like this
And when you hold me like that
It was gone with the wind
But it's all coming back to me
When you see me like this
And when I see you like that
Then we see what we want to see
All coming back to me
The flesh and the fantasies
All coming back to me
I can barely recall
But it's all coming back to me now
If you forgive me all this
If I forgive you all that
We forgive and forget
And it's all coming back to me
When you see me like this
And when I see you like that
We see just what we want to see
All coming back to me
The flesh and the fantasies
All coming back to me
I can barely recall but it's all coming back to me now
(It's all coming back to me now)
And when you kiss me like this
(It's all coming back to me now)
And when I touch you like that
(It's all coming back to me now)
If you do it like this
(It's all coming back to me now)
And if we"
change the world,eric clapton,1996," If I could reach the stars, pull one down for you
Shine it on my heart, so you could see the truth
That this love I have inside is everything it seems
But for now I find, it's only in my dreams And I can change the world
I will be the sunlight in your universe
You would think my love was really something good
Baby if I could change the world If I could be king even for a day
I'd take you as my queen
I'd have it no other way
And our love would rule this kingdom we had made 'Til then I'd be a fool
Wishing for the day
That I can change the world
I would be the sunlight in your universe You would think my love was really something good
Baby if I could change the world
Baby if I could change the world
I could change the world I would be the sunlight in your universe
You would think my love was really something good
Baby if I could change the world
Baby if I could change the world
Baby if I could change the world"
hey lover,ll cool j,1996," I've been watchin' you from afar
For as long as I can remember
You are all a real man can need
And ever ask for, this is love
This is more than a crush It was all up at Rutgers, I saw with your man
Smiling, a coach bag in your hand
I was layin' in the coup with my hat turned back
We caught eyes for a moment and that was that
So skated off as you strolled off
Looking at them legs, god damn they looked so soft
I gotta take ya from your man that's my mission
If his love is real he got ta handle competition You only knew about 5 months
Besides he drinks too much and smokes too many blunts
And I've been workin' out everyday thinkin' 'bout you
Lookin' at my own eyes in the rear view
Catchin' flash backs of our eye contact
Wish I could lay ya on your stomach and caress your back
I would hold ya in my arms and ease your fears
I can't believe it, I had a crush in years Hey lover Hey lover, hey lover, this is more than a crush
Hey lover, hey lover, this is more than a crush
Lover, hey lover, this is more than a crush
Hey lover, hey lover, this is more than a crush I see you at the bus stop waitin' everyday
Your man must think it's safe for you to travel that way
And I don't want ta violate your relationship
So I lay back in the cut with a crush that'a trip
Still he can't stop me from having day dreams
Tonging you down with vanilla ice cream Kissing on your thighs in the moonlight
Searching your body with my tounge girl all night
I wonder one day could it be, simple dreams can turn into reality
Our love would come down so naturally
We would walk down the isle of destiny
What your man got his hustle on gotcha type scared
Break ya off a little chump change to do your hair
That seems to be enough to satisfy your needs
But there's a deeper level if you just follow my lead Hey lover Hey lover, hey lover, this is more than a crush
Hey lover, hey lover, this is more than a crush
Lover, hey lover, this is more than a crush
Hey lover, hey lover, this is more than a crush Last week I saw ya at the mall
Standing at the pay phone 'bout to make a call
I had a vision, it was me on the other end
Telling you come by and then you walked in
I touched you gently with my hands
We talked about travellin' the distant lands
Escaping all the madness out here in the world
Becomin' my wife no longer my girl Then you let your dress fall down to the floor
I kissed you softly and you yearned for more
We experienced pleasure unparallel
Into a ocean of love we both fell
Swimming in the timeless, currents of pure bliss
Fantasies interchanging with each kiss
Undying passion unites our souls
Together we swim until the point of no control But its a fantasy, you won't come true
We never even spoke and your man still love you
So I'm gonna keep all these feelins inside
Keep my dreams alive until the right time Hey, hey lover, hey lover, this is more than a crush
Hey lover, hey lover, this is more than a crush
Lover, hey lover, this is more than a crush
Hey lover, hey lover, this is more than a crush Hey lover, hey lover, this is more than a crush
Hey lover, hey lover, this is more than a crush
Lover, hey lover, this is more than a crush
Hey lover, hey lover, this is more than a crush This is more than a crush
This is more than a crush
This is more than a crush
This is more than a crush"
loungin,ll cool j,1996," keep it chickenhead, im lookin for a dime
get my swirve on, make it hot, word is bond, im lickin on your ankle
bracelet, we'll be sippin' moet wit strawberries and dat shit, im nasty ask me
why i lick my lips so in the darkness i can run my tongue over your tits
its all good sugary, u aint leavin' sit up on my face and help my stash grow
even
whipped cream taste mean from the back she bounce wit' LL now shorty's on the
map
i put away the gat, took off the hat, throw ya mo's in the air if u like it like
that
no doubt boo, i keep it real girl, mad pleasure, blowin up your whole world
whatever's clever i got endless cash, trees from Hawaii, 2 pools or baths [chorus]
i'll be loungin with LL Cool J
i'll be loungin' with LL, hey hey uh, my scenario is grand, a dime peice, hennessey up in my hand
i turn out the lights like teddy, im feenin', standin' in the darkness, now im
ready
uhh, ooh yeah up in ya, let it flow while i pump slow, then i speed it up, heat it
up
make it mo' tasty, so u can swing low and lace me
use your imagination, u do me, i do u, sex education
its all good, it's cranberry absolut, peach shnapps, feelin' tipsy, loungin' on
the rooftops
i'm 'bout to spank u on dat ass(ooh) i know u love it when it lasts(true) when
u need it who u ask (you) what u sayin' when i dash (dont go boo) [chorus] u got to bounce wit me suga, word up, u got to bounce wit me suga, worda
worda, word up... warm it up suga, make it hot, shorties'll swarm, make me wanna bust shots, we
speak daily on the regular, run your jibs all day chip in my cellular
shoot down to jamaica, pretty white sand, suntan oil, pina' coladas in my hand
layin up at night, peepin' at stars, remember, when we was at the club in da
bars?
i told ya my status was that of a don, u thought i was a dog and u aint wanna
get it on, but my mind has attractin' qualities, all the emotions of a young
lady
so here u are, smack dab up in the mix, shorty this here's about as good as it
gets
word up, i'ma treat u like a queen from the heart, crack the bubbly, and let the
episode start. [chorus]"
