unity,queen latifah,1994," Uh, u.n.i.t.y., u.n.i.t.y. that's a unity
u.n.i.t.y., love a black man from infinity to infinity
(who you calling a bitch?)
u.n.i.t.y., u.n.i.t.y. that's a unity (you gotta let him know)
(you go, come on here we go)
u.n.i.t.y., love a black woman from (you got to let him know)
infinity to infinity (you ain't a bitch or a ho)
u.n.i.t.y., u.n.i.t.y. that's a unity (you gotta let him know)
(you go, come on here we go)
u.n.i.t.y., love a black man from (you got to let him know)
infinity to infinity (you ain't a bitch or a ho)
Instinct leads me to another flow
everytime i hear a brother call a girl a bitch or a ho
trying to make a sister feel low
you know all of that gots to go
now everybody knows there's exceptions to this rule
now don't be getting mad, when we playing, it's cool
but don't you be calling out my name
i bring wrath to those who disrespect me like a dame
that's why i'm talking, one day i was walking down the block
i had my cutoff shorts on right cause it was crazy hot
i walked past these dudes when they passed me
one of 'em felt my booty, he was nasty
i turned around red, somebody was catching the wrath
then the little one said (yeah me bitch) and laughed
since he was with his boys he tried to break fly
huh, i punched him dead in his eye and said ""who you calling a bitch?""
(here we go)
u.n.i.t.y., u.n.i.t.y. that's a unity (you gotta let him know)
(you go, come on here we go)
u.n.i.t.y., love a black woman from (you got to let him know)
infinity to infinity (you ain't a bitch or a ho)
(here we go)
u.n.i.t.y., u.n.i.t.y. that's a unity (you gotta let him know)
(you go, come on here we go)
u.n.i.t.y., love a black man from (you got to let him know)
infinity to infinity (you ain't a bitch or a ho)
I hit the bottom, there ain't nowhere else to go but up
bad days at work, give you an attitude then you were rough
and take it out on me but that's about enough
you put your hands on me again i'll put your ass in handcuffs
i guess i fell so deep in love i grew dependency
i was too blind to see just how it was affecting me
all i knew was you, you was all the man i had
and i was scared to let you go, even though you treated me bad
but i don't want my kids to see me getting beat down
by daddy smacking mommy all around
you say i'm nothing without ya, but i'm nothing with ya
a man don't really love you if he hits ya
this is my notice to the door, i'm not taking it no more
i'm not your personal whore, that's not what i'm here for
and nothing good gonna come to ya til you do right by me
brother you wait and see (who you calling a bitch?)
(here we go)
u.n.i.t.y., u.n.i.t.y. that's a unity (you gotta let him know)
(you go, come on here we go)
u.n.i.t.y., love a black woman from (you got to let him know)
infinity to infinity (you ain't a bitch or a ho)
(here we go)
u.n.i.t.y., u.n.i.t.y. that's a unity (you gotta let him know)
(you go, come on here we go)
u.n.i.t.y., love a black man from (you got to let him know)
infinity to infinity (you ain't a bitch or a ho)
What's going on in your mind is what i ask ya
but like yo-yo, you don't hear me though
you wear a rag around your head and you call yourself
a ""gangsta bitch"" now that you saw apache's video
i saw you wilding, acting like a fool
i peeped you out the window jumping girls after school
but where did all of this come from?
a minute ago, you was a nerd and nobody ever heard of ya
now you a wannabe... hard
you barely know your abc's, please
there's plenty of people out there with triggers ready to pull it
why you trying to jump in front of the bullet (young lady)
uh, and real bad girls are the silent type
ain't none of this work getting your face sliced
cause that's what happened to your homegirl, right? bucking with nobody
she got to wear that for life (who you calling a bitch?)
(here we go)
u.n.i.t.y., u.n.i.t.y. that's a unity (you gotta let him know)
(you go, come on here we go)
u.n.i.t.y., love a black woman from (you got to let him know)
infinity to infinity (you ain't a bitch or a ho)
(here we go)
u.n.i.t.y., u.n.i.t.y. that's a unity (you gotta let him know)
(you go, come on here we go)
u.n.i.t.y., love a black man from (you must let him know)
infinity to infinity (you ain't a bitch or a ho) 1993 motown records/polygram single"
prayer for the dying,seal,1994," Da da, da da Ah, ho-oo-oh-oo Fearless people,
Careless needle.
Harsh words spoken,
And lives are broken. Forceful ageing,
Help me I'm fading.
Heaven's waiting,
It's time to move on. Crossing that bridge,
With lessons I've learned.
Playing with fire,
And not getting burned.
I may not know what you're going through.
But time is the space,
Between me and you.
Life carries on... it goes on. Just say die,
And that would be pessimistic.
In your mind,
We can walk across the water.
Please don't cry,
It's just a prayer for the dying.
I just don't know what's got into me. Been crossin' that bridge,
With lessons I've learned.
...learned... Playing with fire,
And not getting burned.
...burned burned... I may not know what you're going through,
But time is the space,
Between me and you. There is a light through that window
...light through that window...
Hold on say yes, while people say no Life carries on
...on on on...
Ohh!
It goes on... oh-ee-oh, whoa-ee-oh ho oh... I'm crossing that bridge,
With lessons I've learned...
I'm playing with fire,
And not getting burned...
I may not know what you're going through.
But time is the space,
Between me and you.
There is a light through that window.
Hold on say yes, while people say no 'Cause life carries on... oh-ee-oh, whoa-ee-oh ho on...
It goes on... oh-ee-on,
It goes on.
Whoah.
Whoah.
Life carries on. When nothing else matters. When nothing else matters. I just don't know what's got into me. It's just a prayer for the dying.
...dying dying dying dying... For the dying."
secret,madonna,1994," O nae mamiya mamiya mami mamiya
I'm going to tell you a secret
O nae mamiya mamiya mami mamiya
Ma Ma Ma Ma Madonna donna
Madonna donna donna
Moduga Hot Hot
Nattaeme nattaeme nattaeme Hot Hot Hot
Madonna donna
Madonna donna donna
Neukkyeobwa nal nal
Moduda moduda moduda Hot Hot Hot
Boyeojwodo mideul suga eomneun
Geu nugudo sangsanghal su eomneun
Oh Oh Oh Oh Oh Oh
Lady Lady Lady
Ttara hal su eomneun fashionista
Naega hamyeon geuge Trendy hot style
Oh Oh Oh Oh Oh Oh
Lady Lady Lady
Hago sipeun daero saenggak hamyeon dwae
Jasin itge hago sipeun daero hae
Oh Lady Every time make it hot
Oh Lady jom deo sorichyeobwa Make it high
Dangdanghage jasin itge malhaebwa
Soljikhage ne mameul da malhaebwa
Saneun geoya baro nacheoreom
Ma Ma Ma Ma Madonna donna
Madonna donna donna
Moduga Hot Hot
Nattaeme nattaeme nattaeme Hot Hot Hot
Madonna donna
Madonna donna donna
Neukkyeobwa nal nal
Moduda moduda moduda Hot Hot Hot
O nae mamiya mamiya mami mamiya
Nae mamiya mamiya mami mamiya
O nae mamiya mamiya mami mamiya
Mam mam mam nae mamiya
Naega naega baro Sexy Icon
Geu nugudo makji motal Control
Oh Oh Oh Oh Oh Oh
Lady Lady Lady
Duryeoul ge eomneun Super Women
Museoul ge eomneun Wonder Women
Oh Oh Oh Oh Oh Oh
Lady Lady Lady
Neukkim itge dodohage geureoke
Gwagamhage senseu itge geureoke
Oh Lady mangseoriji malgo neukkyeobwa
Oh Lady jigeum isunganeul jeulgyeobwa
Dangdanghage meositge neul geureoke
Yeosincheoreom bitnage neul geureoke
Saneun geoya baro nacheoreom
Ma Ma Ma Ma Madonna donna
Madonna donna donna
Moduga Hot Hot
Nattaeme nattaeme nattaeme Hot Hot Hot
Madonna donna
Madonna donna donna
Neukkyeobwa nal nal
O nae mamiya mamiya mami mamiya
Nae mamiya mamiya mami mamiya
O nae mamiya mamiya mami mamiya
Mam mam mam nae mamiya
Like A saenggakdaero neoreul matgyeo
Fire jinan sigandeureul taewo
M A D O Double N A
Jasin itge momeul umjigyeo
Move it Groove it Shake it
Nuguboda michige deo sinnage
Amudo ttara haji motage
Yo ijebuteo modeungeol da boyeojulge
Wanna Wanna Wanna Wanna Primadonna
Ma Ma Ma Ma Madonna donna
Madonna donna donna
Moduga Hot Hot
Nattaeme nattaeme nattaeme Hot Hot Hot
Madonna donna
Madonna donna donna
Neukkyeobwa nal nal
Moduda moduda moduda Hot Hot Hot
Madonna donna
Madonna donna donna
Moduga Hot Hot
Nattaeme nattaeme nattaeme Hot Hot Hot
Madonna donna
Madonna donna donna
Neukkyeobwa nal nal
Moduda moduda moduda Hot Hot Hot
Moduda moduda Hot Hot Hot"
here comes the hotstepper,ini kamoze,1994," Hit it
Nah, na na na nah, na na na nah,
na na nah, na na nah, na na na nah Here comes the hotstepper, murderer
I'm the lyrical gangster, murderer
Big up the crew in-a de area, murderer
Still love you like that, murderer No, no, we don't die
Yes, we multiply
Anyone test will hear the fat lady sing.
Act like you know, Rico
I know what Bo don't know
Touch them up and go, uh-oh
Ch-ch-chang-chang Here comes the hotstepper, murderer
I'm the lyrical gangster, murderer
Excuse me mister officer, murderer
Still love you like that, murderer Extraordinary
Juice like a strawberry.
Money to burn baby, all of the time
Cut to fit is me
Fit to cut is she
Come juggle with me, I say every time Here comes the hotstepper, murderer
I'm the lyrical gangster, murderer
Dial emergency number, murderer
Still love you like that, murderer Nah, na na na nah, na na na nah, na na nah,
na na nah, na na na nah
It's how we do it man
Nah, na na na nah, na na na nah, na na nah,
na na nah, na na na nah Start like a jackrabbit
Finish in front of it
On the night is jack, that's it, understand
I'm the daddy of the mack daddy
His are left in gold, maybe
Ain't no homie gonna play me, top celebrity man Murderer
I'm the lyrical gangster, murderer
Excuse me mister officer, murderer
Still love you like that, murderer No, no, we don't die
Yes, we multiply
Anyone test will hear the fat lady sing
Act like you know, 'G' go
I know what Bo don't know
Touch them up and go, uh-oh
Ch-ch-chang-chang Here comes the hotstepper, murderer
I'm the lyrical gangster, murderer
Big up the crew in-a de area, murderer
Still love you like that, murderer Nah, na na na nah, na na na nah, na na nah,
na na nah, na na na nah, yeah man
Nah, na na na nah, na na na nah,
na na nah, na na nah, na na na nah, right Here comes the hotstepper, murderer
I'm the lyrical gangster, murderer
Big up all crew bow ya, murderer
Still love you like that, murderer Here comes the hotstepper, murderer
I'm the lyrical danger, murderer
Pick up the crew in-a the area, murderer
Still love you like that, murderer I'm the lyrical gangster
I'm a live in-a me danger
Still love you like that Hey"
everyday,phil collins,1994," I got lost, couldn't find my way
And I guess there's nothin' more 2 say
Love can make you blind, make you act so strange
But I'm here and here I will stay
So everyday I cry
Yes everyday I fall
Do you ever wonder why, why I love everythin' about you?
But everyday I say, ""I'll try to make my heart be still""
'Til then every way there is to cry, ourselves to sleep we will
It picked me up, knocked me off my feet
I've got no way to explain
Still I love you, love you, love you but this fire inside
Will never see the light of day
So everyday goes by and everyday I fall
It makes me wonder why?
My life's worth nothing without you
But everyday I say, ""I'll try to make my heart be still""
'Cos every way there is to cry ourselves to sleep, we will
You'll never know, no, no, no, no, no
You'll never know just how close we were
You'll never know, no, no, no, no, no
You'll never know
No you'll never see
The book closes and we try to forget
But I know that things won't change
How we feel, how life goes on
And that seems so strange
And so the light fades away
Try, try, try as I may
I can't stop thinkin' about you
It seems my life's worth nothing without you
But everyday I say, ""I'll try to make my heart be still""
'Til then every way there is to cry, ourselves to sleep we will
Everyday, everyday, you know I try so hard
Everyday, everyday, it gets a little harder
Everyday, everyday, you know I try so hard
Everyday, everyday, it gets a little harder"
dont take the girl,tim mcgraw,1994," Johnny's daddy, was takin' him fishing
when he was eight years old
A little girl came through the front gate
holdin' a fishin' pole
His dad looked down and smiled
said we can't leave her behind
Son I know you don't want her to go
but someday you'll change your mind And Johnny said
Take Jimmy Johnson, take Timmy Thompson
take my best friend Bo
Take anybody that you want as, long as she don't go
Take any boy in the world
Daddy please, don't take the girl Same old boy, same sweet girl
ten years down the road
He held her tight and kissed her lips in
front of the picture show
Stranger came and pulled a gun
grabbed her by the arm
Said if you do what I tell you to there
won't be any harm And Johnny said
Take my money, take my wallet
take my credit cards
Here's the watch that my grandpa gave me
here's the key to my car
Mister give it a whirl
But please, don't take the girl Same old boy, same sweet girl
five years down the road
There's gonna be a little one and she
says it's time to go
Doctor says the baby's fine
but you'll have to leave
'Cause his momma's fading fast and, Johnny hit his knees And there he prayed
Take the very, breath you gave me
take the heart from my chest
I'll gladly take her place if you'll let me
make this my last request
Take me out of this world
God please, don't take the girl
Johnny's daddy was taking him fishing
When he was eight years old"
got me waiting,heavy d  the boyz,1994," Got me waiting, anticipating
You got me thinking
I want your love
I'm trying to show you
I really, really want to know you
You got me thinking
I want your love I got a funny feeling, honey
That you're kind of digging me
But every time you see me
word is born, you be ignoring me I know your name, yes, I do
Because your girls told me
I know where you live, you want to bet
Because your girls showed me But I'll parlay
And stay out of your way
Figuring I won't be ignorant
And catch you the next day When I'm in focus, I notice you
Only move with a chosen few
Irreplaceable, what's up
With insatiable you I never figured you
For the quiet type
On the down low
The low pro-file type I always thought you
Was a rah rah mama
Stirring up crazy confusion
Causing drama What's the matter, huh
Cat got your tongue
Or some mack got you strung
Or maybe I ain't the one I want to know cause if I don't
It's going to haunt me
Yo, word up
You got me thinking you want me Got me waiting, anticipating
You got me thinking
I want your love
I'm trying to show you
I really, really want to know you
You got me thinking
I want your love I'm steady, picking my brain
Trying to figure your game
What's your angle, tell me
Where you're coming from The whole picture is strange
So I'm digging the frame
Because I like what I see
And I want some So tell me what's your plot
What's your plan
You're looking for
A brother to get got
I'm not your man But believe in me
You want to be with me
But you won't even talk to me
To tell me what it is you see in me I got to hear it from your girls, Uptown
The word got around from my crew
In Brooklyn and in the Boogie Down
Said you had a thing for me
And what would it take for a date
And wait, swing with me I got your cards
You're playing hard to get
I'm long and I'm strong
And if it's on
I keep it soft and wet Let me know cause if you don't
It's going to haunt me
Yo, word up, you got me
Thinking you want me Got me waiting, anticipating
You got me thinking
I want your love
I'm trying to show you
I really, really want to know you
You got me thinking
I want your love ""Hey, yo, hey, yo...""
Look at all the cuties
Swinging in the party
""Hey, yo, hey, yo...""
Look at all the cuties
Swinging in the party I never stumble cause I'm humble
And I'm ready to rap
You got me feeling like I'm sleeping
And it's keeping me trapped But still in all, you want to stroll
And have a fella on layaway
Fronting for nothing like it's
Something for me to stay away
Emotional trips
Get a grip
Because I'm losing it
Ideas was clear
Had it in gear
Now you're confusing it I had the thought
That you were caught
And you were going steady
Wasn't checking for me
Cause you had a friend already But I'm a put it all aside
Cause God is my guide
Swallow my pride, stride
And follow my guide Let me know cause if you don't
It's going to haunt me
Yo, word up, you got me
Thinking you want me Got me waiting, anticipating
You got me thinking
I want your love
I'm trying to show you
I really, really want to know you
You got me thinking
I want your love"
december 1963 oh what a night,the four seasons,1994," Oh, what a night
Late December, back in '63
What a very special time for me
As I remember, what a night Oh, what a night
You know, I didn't even know her name
But I was never gonna be the same
What a lady, what a night Oh, I
I got a funny feeling when she walked in the room
Hey, my
As I recall, it ended much too soon Oh, what a night
Hypnotizing, mesmerizing me
She was everything I dreamed she'd be
Sweet surrender, what a night And I felt a rush like a rolling bolt of thunder
Spinning my head around and taking my body under
Oh, what a night Oh, I
Got a funny feeling when she walked in the room
Hey, my
As I recall, it ended much too soon Oh, what a night
Why'd it take so long to see the light?
Seemed so wrong, but now it seems so right
What a lady, what a night Oh, I felt a rush like a rolling bolt of thunder
Spinning my head around and taking my body under
Oh, what a night (Do do do do do, do do do do)
Oh, what a night (Do do do do do, do do do do)
Oh, what a night (Do do do do do, do do do do)
Oh, what a night (Do do do do do, do do do do)
Oh, what a night (Do do do do do, do do do do)
Oh, what a night (Do do do do do, do do do do)
Oh, what a night (Do do do do do, do do do do)"
indian outlaw,tim mcgraw,1994," I'm an Indian outlaw
Half Cherokee and choctaw
My baby she's a Chippawa
She's a one of a kind All my friends call me Bear claw
Village chieftain is my paw paw
He gets his orders from my maw maw
She makes him walk the line You can find me in my Wigwam
I'll be beatin' on my tom tom
Pull out the pipe and smoke ya some
Hey, and pass it around Cause i'm an Indian outlaw
Half Cherokee and Choctaw
My baby she's a Chippawa
She's a one of a kind I aint lookin' for trouble
We can ride my pony double
Make your little heart bubble, lord
Like a glass a wine I remember the medicine man
He caught the runnin' water in my hands
Drug me around by my head band
Said I wasn't her kind Cause I'm an Indian outlaw
Half Cherokee and Choctaw
My baby she's a Chippawa
She's a one of a kind I can kill a Deer or Buffalo
With just my arrow and my hickory bow
From a hundred yards don't ya know
I do it all the time They all gather round my teepee
Late at night tryin' to catch a peek at me
In nothin but my Buffalo briefs
I got 'em standin' in line Cause i'm an Indian outlaw
Half Cherokee and Choctaw
My baby she's a Chippawa
She's a one of a kind Cherokee people
Cherokee tribe
So proud to live
So proud to die"
always,bon jovi,1994," This Romeo is bleeding
But you can't see his blood
It's nothing but some feelings
That this old dog kicked up It's been raining since you left me
Now I'm drowning in the flood
You see, I've always been a fighter
But without you, I give up I can't sing a love song
Like the way it's meant to be
Well, I guess I'm not that good anymore
But baby, that's just me And I will love you, baby, always
And I'll be there forever and a day, always
I'll be there 'til the stars don't shine
'Til the heavens burst and the words don't rhyme
And I know when I die, you'll be on my mind
And I'll love you, always Now your pictures that you left behind
Are just memories of a different life
Some that made us laugh, some that made us cry
One that made you have to say goodbye
What I'd give to run my fingers through your hair
To touch your lips, to hold you near
When you say your prayers, try to understand
I've made mistakes, I'm just a man When he holds you close, when he pulls you near
When he says the words you've been needing to hear
I wish I was him
With these words of mine
To say to you 'til the end of time That I will love you baby, always
And I'll be there forever and a day, always If you told me to cry for you, I could
If you told me to die for you, I would
Take a look at my face
There's no price I won't pay
To say these words to you Well, there ain't no luck
In these loaded dice
But baby if you give me just one more try
We can pack up our old dreams
And our old lives
We'll find a place where the sun still shines And I will love you, baby, always
And I'll be there forever and a day, always
I'll be there 'til the stars don't shine
'Til the heavens burst and the words don't rhyme
I know when I die, you'll be on my mind
And I'll love you, always Always, always"
far behind,candlebox,1994," Now maybe
I didn't mean to treat you bad
But I did it anyway
And then maybe
Some would say your life was sad
But you lived it anyway
And so maybe
Your friends they stand around they watch you crumble
As you falter down to the ground
And then someday
Your friends they stand beside as you were flying
Oh you were flying oh so high But then someday people look at you for what they call their own
They watch you suffer
Yeah they hear you calling home
And then some day we could take our time
To brush the leaves aside so you can reach us But you left me far behind Now maybe
I didn't mean to treat you oh so bad
But I did it anyway Now maybe some would say you're left with what you had
But you couldn't share the pain No, no, no
Couldn't share the pain, they watch you suffer Now maybe I could have made my own mistakes
But I live with what I've known
And then maybe we might share in something rare
But won't you look at where we've grown
Won't you look at where we've gone
But then someday comes
Tomorrow holds a sense of what I feel for you in my mind
As you trip the final line
And that cold day when you lost control
Shame you left my life so soon you should have told me
But you left me far behind
Now maybe I didn't mean to treat you oh so bad But I did it anyway
Now maybe some would say you're left with what you had
But you couldn't share the pain No, no, no
Now maybe I didn't mean to treat you oh so bad But I did it anyway
Now maybe baby some would say you're left with what you had
But you couldn't share the pain
I said times have changed your friends
They come and watch you crumble to the ground
They watch you suffer
Yeah, they hold you down
Hold you down
Now maybe oh oh, maybe
I didn't mean to treat you bad
But you left me far behind
Left me far behind
Left me far behind"
love sneakin up on you,bonnie raitt,1994," Rainy night, I'm all alone
Sittin here waiting for your voice on the phone
Fever turns
To cold, cold sweat thinkin about things we ain't done yet
Tell me now
I gotta know, do you feel the same?
Do you just light up at the mention of my name? Don't worry baby, it ain't nothin new
That's just love sneakin up on you
And if your whole work is shakin, feel like I do
That's just love sneakin up on you Hey heyyy yea Nowhere on earth for your heart to hide
Once love comes sneakin up on your blind side
You might as well
Try to stop the rain
Stand in the track of a runaway train
Just can't fight it when a thing is meant to be yea
Come on let's finish what you started with me
Yeeaahhh Don't worry baby, it ain't nothin new
That's just love sneakin up on you
And if your whole work is shakin, feel like I do
That's just love sneakin up on you Heeey yea Don't worry baby, it ain't nothin new
That's just love sneakin up on you
And if your whole work is shakin, feel like I do
That's just love sneakin up on you (repeat)"
always in my heart,tevin campbell,1994," Where do they get off telling you
that I am not the least bit into
Just tell me how the hell the can tell you they know what's in my heart
What do they get from telling you
that I don't give a damn about you
Just tell me why the hell somebody wants to tear your heart apart Oh why, oh why, oh why, oh why, oh why
Why do them people have to tell you lies
I know, I know, I know, I know, I know
I love you more than words could ever show
I can't, I can't, I can't, I can't explain
Why do some people have to be that way
I can't take much more, I can't ignore
I have to let you know what's in my heart If I never ever say that I love you
Just remember, girl, I'm saying I do
You can know that from this moment you are always in my heart
If I never ever say that I love you
Just remember, girl, I'm saying I do
love you
You'll be always in my heart They're not the ones to be there for you
When you need someone to turn to
They won't be anywhere, be anywhere when things start falling down
Oh, yeah
They're only in it to confuse you
So they can turn around and use you
But it can't happen, it won't happen girl as long as I'm around Oh why, oh why, oh why, oh why, oh why
Why do some people have to tell you lies
I know, I know, I know, I know, I know
I love you more than words could ever show
I can't, I can't, I can't, I can't explain
Why do some people have to be that way
I can't take much more, I can't ignore
I have to let you know what's in my heart If I never ever say that I love you
Just remember, girl, I'm saying I do
You can know that from this moment you are always in my heart
If I never ever say that I love you
Just remember, girl, I'm saying I do
love you
You'll be always in my heart Oh, why
Why, why, why
Yeah
Why did you have to listen to the lies
Oh, girl
My sweet girl
Well, there is only you inside my world
Oh, please
Baby, please
I wish you could believe in me
Right now
Right now
If only you could know If I never ever say that I love you
Just remember, girl, I'm saying I do
You should know that from this moment you are always in my heart
If I never ever say that I love you
Just remember, girl, I'm saying I do
love you
You'll be always in my heart"
